<?xml version="1.0" encoding="UTF-8"?>
<processdata fid="1" pid="2" spid="3" pnumber="proc2" creator="creator" creationDate="2008-09-16T09:05:20Z" currentUser="user" lastUpdate="2008-09-19T09:05:20Z" closed="0" 
   xmlns:xsi="http://www.w3.org/2001/XMLSchema-instance"
   xmlns="http://www.iflow.pt/ProcessData"
   xsi:schemaLocation="http://www.iflow.pt/ProcessData processdata.xsd"
   >
            <e><![CDATA[Um erro qualquer & outra coisa...]]></e>
            <a n="aText">Some text</a>
            <a n="aInteger">100000000000006200000</a>
            <a n="aFloat">100000000000000330000</a>
            <a n="aDate">31072008140753000</a>
            <l n="lText" s="4">
                <i p="0">Text value 0</i>
                <i p="2">Text value 2</i>
            </l>
            <l n="lInteger" s="4">
                <i p="0">100000000000006200000</i>
                <i p="2">000000000000003200000</i>
            </l>
            <l n="lFloat" s="4">
                <i p="0">000000000000012234000</i>
                <i p="2">100000000000012234000</i>
            </l>
            <l n="lDate" s="4">
                <i p="0">21052008140753000</i>
                <i p="2">21062008140753000</i>
            </l>
</processdata>
