<?xml version="1.0" encoding="UTF-8"?><processdata xmlns="http://www.iflow.pt/ProcessData" xmlns:xsi="http://www.w3.org/2001/XMLSchema-instance" xsi:schemaLocation="http://www.iflow.pt/ProcessData processdata.xsd" fid="1" pid="2" spid="3" pnumber="proc2" creator="creator" creationDate="2008-09-16T09:05:20Z" currentUser="user" lastUpdate="2008-09-19T09:05:20Z" closed="0"><e/><a n="aDate">31072008140753000</a><a n="aFloat">100000000000000330000</a><a n="aInteger">100000000000006200000</a><a n="aText">Helló&lt;&gt;wõrlçad!</a><l n="lDate" s="4"><i p="0">21052008140753000</i><i p="2">21062008140753000</i></l><l n="lFloat" s="4"><i p="0">000000000000012234000</i><i p="2">100000000000012234000</i></l><l n="lInteger" s="4"><i p="0">100000000000006200000</i><i p="2">000000000000003200000</i></l><l n="lText" s="4"><i p="0">Text value 0</i><i p="2">Text value 2</i></l></processdata>